{
  "schema_version": "7.0",
  "artifact_type": "kristall_crystallization_record",
  "record_id": "crystallization:001",
  "created_at": "2026-10-02T17:15:00Z",
  "inputs": [
    {
      "source_id": "urn:kristal:power-formal"
    },
    {
      "source_id": "urn:kristal:power-informal"
    }
  ],
  "stages": [
    {
      "stage": "ingest",
      "status": "completed"
    },
    {
      "stage": "verify_identity",
      "status": "completed"
    },
    {
      "stage": "entity_resolution",
      "status": "completed",
      "metrics": {
        "accepted": 1
      }
    },
    {
      "stage": "mesh_update",
      "status": "completed"
    },
    {
      "stage": "axis_discovery",
      "status": "completed",
      "metrics": {
        "candidates": 1
      }
    },
    {
      "stage": "reconstruction_test",
      "status": "completed",
      "metrics": {
        "coverage": 0.98
      }
    }
  ],
  "proposals": [
    {
      "type": "axis_candidate",
      "axis_id": "axis:informal-influence"
    }
  ],
  "accepted_changes": [
    {
      "type": "entity_resolution",
      "record_id": "resolution:001"
    },
    {
      "type": "axis_activation",
      "axis_id": "axis:informal-influence"
    }
  ],
  "metrics": {
    "representation_compression": 0.31,
    "source_coverage": 1.0,
    "provenance_retention": 1.0,
    "projection_reconstruction_coverage": 0.98,
    "unresolved_identity_candidates": 0,
    "conflicts_preserved": 0
  }
}
